Symbol,Name,Last Sale,Net Change,% Change,Market Cap,Country,IPO Year,Volume,Sector,Industry
GS,Goldman Sachs Group Inc. (The) Common Stock,$327.67,-14.42,-4.215%,110438202188.00,United States,1999,4554702,Finance,Investment Bankers/Brokers/Service
GSAT,Globalstar Inc. Common Stock,$1.16,0.01,0.87%,2089160000.00,United States,2006,4537724,Consumer Discretionary,Telecommunications Equipment
GSK,GSK plc American Depositary Shares (Each representing two Ordinary Shares),$33.50,0.00,0.00%,68585872446.00,United Kingdom,2022,2418121,Health Care,Biotechnology: Pharmaceutical Preparations
GT,The Goodyear Tire & Rubber Company Common Stock,$10.88,-0.40,-3.546%,3079160278.00,United States,,7702703,Consumer Discretionary,Automotive Aftermarket
GTES,Gates Industrial Corporation plc Ordinary Shares,$13.47,-0.49,-3.51%,3806670896.00,,2018,1796369,Industrials,Industrial Machinery/Components
GTLB,GitLab Inc. Class A Common Stock,$44.355,-3.015,-6.365%,6639943500.00,United States,2021,2483906,Technology,EDP Services
GTLS,Chart Industries Inc. Common Stock,$132.13,-11.85,-8.23%,5623195543.00,United States,2006,1250724,Technology,Electrical Products
GWRE,Guidewire Software Inc. Common Stock,$71.50,-1.57,-2.149%,5854148086.00,United States,2012,876399,Technology,Computer Software: Prepackaged Software
GWW,W.W. Grainger Inc. Common Stock,$677.88,-15.13,-2.183%,34252776802.00,United States,,238573,Consumer Discretionary,Telecommunications Equipment
GXO,GXO Logistics Inc. Common Stock ,$46.35,-2.05,-4.236%,5505258840.00,,2021,1132923,,
H,Hyatt Hotels Corporation Class A Common Stock,$110.71,-1.59,-1.416%,11859126444.00,United States,2009,768774,Consumer Discretionary,Hotels/Resorts
HAE,Haemonetics Corporation Common Stock,$75.35,-1.66,-2.156%,3801220783.00,United States,1991,365069,Health Care,Medical/Dental Instruments
HAL,Halliburton Company Common Stock,$34.53,-1.04,-2.924%,31219279035.00,United States,,8527766,Energy,Oil & Gas Production
HALO,Halozyme Therapeutics Inc. Common Stock,$41.63,-1.11,-2.597%,5628919605.00,United States,,1124535,Health Care,Biotechnology: Biological Products (No Diagnostic Substances)
HAS,Hasbro Inc. Common Stock,$49.21,-2.00,-3.905%,6796576260.00,United States,,2385139,Consumer Discretionary,Recreational Games/Products/Toys
HASI,Hannon Armstrong Sustainable Infrastructure Capital Inc. Common Stock,$27.65,-1.58,-5.405%,2511643271.00,United States,2013,1021667,Real Estate,Real Estate Investment Trusts
HAYW,Hayward Holdings Inc. Common Stock,$11.43,-0.33,-2.806%,2414891058.00,United States,2021,1817488,Technology,Electronic Components
HBAN,Huntington Bancshares Incorporated Common Stock,$13.37,-0.37,-2.693%,19293135739.00,United States,,43245378,Finance,Major Banks
HCA,HCA Healthcare Inc. Common Stock,$246.60,-5.53,-2.193%,68299914240.00,United States,2011,1200225,Health Care,Hospital/Nursing Management
HCM,HUTCHMED (China) Limited American Depositary Shares,$14.20,-0.91,-6.023%,2455961966.00,Hong Kong,2016,186199,Health Care,Biotechnology: Pharmaceutical Preparations
HCP,HashiCorp Inc. Class A Common Stock,$27.93,-1.80,-6.054%,5249951938.00,United States,2021,2564006,Technology,EDP Services
HD,Home Depot Inc. (The) Common Stock,$286.31,-1.69,-0.587%,291803149959.00,United States,,4728218,Consumer Discretionary,RETAIL: Building Materials
HDB,HDFC Bank Limited Common Stock,$64.42,-1.76,-2.659%,119782792667.00,India,2001,2433120,Finance,Commercial Banks
HE,Hawaiian Electric Industries Inc. Common Stock,$37.33,-1.76,-4.502%,4086531488.00,United States,,962527,Utilities,Power Generation
HEI,Heico Corporation Common Stock,$167.78,-3.77,-2.198%,22937291885.00,United States,2000,297047,Industrials,Military/Government/Technical
HELE,Helen of Troy Limited Common Stock,$102.20,-1.93,-1.853%,2452010812.00,Bermuda,,584711,Consumer Discretionary,Home Furnishings
HEP,Holly Energy Partners L.P. Common Stock,$18.16,0.06,0.331%,2296154050.00,United States,2004,105486,,
HES,Hess Corporation Common Stock,$129.63,-4.25,-3.174%,39966026448.00,United States,,1622601,Energy,Oil & Gas Production
HGV,Hilton Grand Vacations Inc. Common Stock ,$45.08,-1.74,-3.716%,5186804227.00,,2016,1079394,Consumer Discretionary,Hotels/Resorts
HHC,Howard Hughes Corporation (The) Common Stock,$75.36,-3.38,-4.293%,3760529714.00,United States,,165045,Real Estate,Building operators
HI,Hillenbrand Inc Common Stock,$45.35,-1.82,-3.858%,3147151955.00,United States,,263973,Consumer Discretionary,Consumer Specialties
HIG,Hartford Financial Services Group Inc. (The) Common Stock,$70.20,-1.88,-2.608%,22120020000.00,United States,,2450071,Finance,Property-Casualty Insurers
HII,Huntington Ingalls Industries Inc. Common Stock,$207.96,-2.05,-0.976%,8288415079.00,United States,,266808,Industrials,Metal Fabrications
HIW,Highwoods Properties Inc. Common Stock,$23.62,-1.59,-6.307%,2485080466.00,United States,1994,1388468,Real Estate,Real Estate Investment Trusts
HL,Hecla Mining Company Common Stock,$5.17,0.04,0.78%,3142440148.00,United States,,7721022,Basic Materials,Precious Metals
HLI,Houlihan Lokey Inc. Class A Common Stock,$87.78,-2.34,-2.597%,6023580874.00,United States,2015,608558,Finance,Investment Managers
HLIO,Helios Technologies Inc. Common Stock,$66.50,-2.06,-3.005%,2165005654.00,United States,2021,109663,Industrials,Fluid Controls
HLN,Haleon plc American Depositary Shares (Each representing two Ordinary Shares),$7.68,-0.06,-0.775%,35460763507.00,,2022,3545778,,
HLNE,Hamilton Lane Incorporated Class A Common Stock,$65.44,-7.85,-10.711%,2478113724.00,United States,2017,875248,Finance,Investment Managers
HLT,Hilton Worldwide Holdings Inc. Common Stock ,$140.55,-1.86,-1.306%,37449640825.00,,2016,2692276,Consumer Discretionary,Hotels/Resorts
HMC,Honda Motor Company Ltd. Common Stock,$26.26,-0.14,-0.53%,44220799159.00,Japan,,1084863,Consumer Discretionary,Auto Manufacturing
HOG,Harley-Davidson Inc. Common Stock,$39.76,-1.55,-3.752%,5812276397.00,United States,,4264459,Consumer Discretionary,Motor Vehicles
HOLX,Hologic Inc. Common Stock,$77.68,-0.81,-1.032%,19152316740.00,United States,1990,952803,Health Care,Medical Electronics
HOMB,Home BancShares Inc. Common Stock,$21.93,0.01,0.046%,4461307620.00,United States,2006,1903979,Finance,Major Banks
HON,Honeywell International Inc. Common Stock,$193.33,0.45,0.233%,129171554919.00,United States,,3667139,Industrials,Consumer Electronics/Appliances
HOOD,Robinhood Markets Inc. Class A Common Stock,$9.01,-0.43,-4.555%,8043691655.00,United States,2021,12775075,Technology,Computer Software: Prepackaged Software
HP,Helmerich & Payne Inc. Common Stock,$39.37,-0.86,-2.138%,4112772759.00,United States,,1475017,Energy,Oil & Gas Production
HPE,Hewlett Packard Enterprise Company Common Stock,$14.33,-0.38,-2.583%,18583333658.00,United States,2015,17290620,Telecommunications,Telecommunications Equipment
HPK,HighPeak Energy Inc. Common Stock,$22.76,-1.44,-5.95%,2575585943.00,United States,,597058,Energy,Oil & Gas Production
HPQ,HP Inc. Common Stock,$27.45,-0.44,-1.578%,26959902100.00,United States,,6869084,Technology,Computer Manufacturing
HQY,HealthEquity Inc. Common Stock,$61.68,-4.81,-7.234%,5220584653.00,United States,2014,1473741,Health Care,Managed Health Care
HR,Healthcare Realty Trust Incorporated Common Stock,$18.44,-0.56,-2.947%,7017753028.00,United States,,4912257,Real Estate,Real Estate Investment Trusts
HRB,H&R Block Inc. Common Stock,$35.58,-0.65,-1.794%,5418018827.00,United States,,1441009,Consumer Discretionary,Other Consumer Services
HRI,Herc Holdings Inc. Common Stock ,$126.36,-8.72,-6.455%,3680000097.00,,2016,502397,Consumer Discretionary,Diversified Commercial Services
HRL,Hormel Foods Corporation Common Stock,$39.18,-0.54,-1.36%,21408899921.00,United States,,2523454,Consumer Staples,Meat/Poultry/Fish
HRMY,Harmony Biosciences Holdings Inc. Common Stock,$41.26,-1.46,-3.418%,2447442278.00,United States,2020,609057,Health Care,Biotechnology: Pharmaceutical Preparations
HSAI,Hesai Group American Depositary Share each ADS represents one Class B ordinary share,$19.00,-0.02,-0.105%,2385157267.00,China,2023,474797,,
HSBC,HSBC Holdings plc. Common Stock,$35.31,-1.41,-3.84%,141016374708.00,United Kingdom,,5829204,Finance,Savings Institutions
HSIC,Henry Schein Inc. Common Stock,$77.04,-0.21,-0.272%,10114081996.00,United States,1995,959238,Health Care,Medical Specialities
HST,Host Hotels & Resorts Inc. Common Stock,$15.90,-0.20,-1.242%,11343060000.00,United States,,11332546,Real Estate,Real Estate Investment Trusts
HSY,The Hershey Company Common Stock,$237.74,-0.88,-0.369%,48507508179.00,United States,,789079,Consumer Staples,Specialty Foods
HTHT,H World Group Limited American Depositary Shares,$48.31,0.52,1.088%,15381145050.00,China,2010,1528576,Consumer Discretionary,Hotels/Resorts
HTZ,Hertz Global Holdings Inc Common Stock,$17.21,-1.27,-6.872%,5548649975.00,United States,,5539150,Consumer Discretionary,Rental/Leasing Companies
HUBB,Hubbell Inc Common Stock,$239.29,-7.54,-3.055%,12826085660.00,United States,2015,428224,Technology,Industrial Machinery/Components
HUBG,Hub Group Inc. Class A Common Stock,$88.45,-2.18,-2.405%,2938443798.00,United States,1996,153299,Consumer Discretionary,Oil Refining/Marketing
HUBS,HubSpot Inc. Common Stock,$369.70,-23.23,-5.912%,18260311498.00,United States,2014,1057851,Technology,Computer Software: Prepackaged Software
HUM,Humana Inc. Common Stock,$479.66,-6.67,-1.371%,59945442307.00,United States,,886165,Health Care,Medical Specialities
HUN,Huntsman Corporation Common Stock,$27.29,-0.47,-1.693%,5242394127.00,United States,2005,2416923,Industrials,Major Chemicals
HWC,Hancock Whitney Corporation Common Stock,$42.48,-0.76,-1.758%,3650773680.00,United States,,1174407,Finance,Major Banks
HWM,Howmet Aerospace Inc. Common Stock,$40.84,-1.22,-2.901%,16837631839.00,United States,,4154050,Industrials,Military/Government/Technical
HXL,Hexcel Corporation Common Stock,$68.41,-2.06,-2.923%,5765926178.00,United States,,940082,Industrials,Industrial Machinery/Components
HZNP,Horizon Therapeutics Public Limited Company Ordinary Shares,$110.04,0.39,0.356%,25132191967.00,Ireland,2011,892689,Health Care,Biotechnology: Pharmaceutical Preparations
IAA,IAA Inc. Common Stock ,$41.51,3.90,10.37%,5552783360.00,,2019,17197277,Consumer Discretionary,Other Specialty Stores
IAC,IAC Inc. Common Stock,$49.02,-1.34,-2.661%,4357878000.00,United States,,955612,Consumer Discretionary,EDP Services
IART,Integra LifeSciences Holdings Corporation Common Stock,$52.87,-0.74,-1.38%,4415605278.00,United States,,758959,Health Care,Medical/Dental Instruments
IBA,Industrias Bachoco S.A.B. de C.V. Common Stock,$59.58,5.7734,10.73%,2979000000.00,Mexico,1997,24889,Consumer Staples,Meat/Poultry/Fish
IBKR,Interactive Brokers Group Inc. Class A Common Stock,$80.29,-5.24,-6.127%,8259608938.00,United States,2019,2375459,Finance,Investment Bankers/Brokers/Service
IBM,International Business Machines Corporation Common Stock,$125.45,-0.71,-0.563%,113422652238.00,United States,,5990224,Technology,EDP Services
IBN,ICICI Bank Limited Common Stock,$20.34,-0.20,-0.974%,70990989514.00,India,,7139694,Finance,Commercial Banks
IBOC,International Bancshares Corporation Common Stock,$45.04,0.16,0.357%,2797605822.00,United States,,509454,Finance,Major Banks
IBP,Installed Building Products Inc. Common Stock,$109.29,-5.17,-4.517%,3126066897.00,,2014,222704,Industrials,Wholesale Distributors
IBTX,Independent Bank Group Inc Common Stock,$52.96,0.63,1.204%,2181458254.00,United States,2013,368423,Finance,Major Banks
ICE,Intercontinental Exchange Inc. Common Stock,$95.39,-4.71,-4.705%,53308820547.00,United States,2005,5375050,Finance,Investment Bankers/Brokers/Service
ICFI,ICF International Inc. Common Stock,$106.22,-1.36,-1.264%,2001598527.00,United States,2006,70553,Consumer Discretionary,Professional Services
ICL,ICL Group Ltd. Ordinary Shares,$6.93,-0.12,-1.702%,8934010879.00,Israel,2014,3189778,Industrials,Agricultural Chemicals
ICLR,ICON plc Ordinary Shares,$213.91,-7.69,-3.47%,17464741631.00,Ireland,1998,807503,Health Care,Biotechnology: Commercial Physical & Biological Resarch
ICUI,ICU Medical Inc. Common Stock,$153.15,-1.82,-1.174%,3672780202.00,United States,1992,178139,Health Care,Medical/Dental Instruments
IDA,IDACORP Inc. Common Stock,$101.68,-0.20,-0.196%,5141974581.00,United States,,317399,Utilities,Electric Utilities: Central
IDCC,InterDigital Inc. Common Stock,$73.60,-0.26,-0.352%,2183568038.00,United States,,300395,Telecommunications,Telecommunications Equipment
IDXX,IDEXX Laboratories Inc. Common Stock,$454.86,-17.42,-3.688%,37709427333.00,United States,1991,456301,Health Care,Biotechnology: In Vitro & In Vivo Diagnostic Substances
IEP,Icahn Enterprises L.P. Common Stock,$50.40,-0.55,-1.079%,17008687130.00,United States,,2235691,Energy,Integrated oil Companies
IEX,IDEX Corporation Common Stock,$219.93,-3.20,-1.434%,16587364502.00,United States,1989,466183,Industrials,Fluid Controls
IFF,International Flavors & Fragrances Inc. Common Stock,$84.64,-1.43,-1.661%,21580005094.00,United States,,1588868,Industrials,Major Chemicals
IFS,Intercorp Financial Services Inc. Common Shares,$22.42,-0.42,-1.839%,2587663287.00,,2019,27576,Finance,Commercial Banks
IGT,International Game Technology Ordinary Shares,$23.83,-0.98,-3.95%,4749517861.00,United States,2015,1411319,Consumer Discretionary,Movies/Entertainment
IHG,Intercontinental Hotels Group American Depositary Shares (Each representing one Ordinary Share),$67.06,-1.19,-1.744%,11761875905.00,United Kingdom,,467683,Consumer Discretionary,Hotels/Resorts
IHS,IHS Holding Limited Ordinary Shares,$7.21,-0.23,-3.091%,2391470480.00,,2021,305378,Telecommunications,Telecommunications Equipment
IIPR,Innovative Industrial Properties Inc. Common Stock,$80.03,-3.07,-3.694%,2238217737.00,United States,2016,436060,Real Estate,Real Estate Investment Trusts
ILMN,Illumina Inc. Common Stock,$194.01,-8.58,-4.235%,30653580000.00,United States,2000,945484,Health Care,Medical Specialities
IMCR,Immunocore Holdings plc American Depositary Shares,$51.39,-1.60,-3.019%,2461835843.00,United Kingdom,2021,490368,Health Care,Biotechnology: Biological Products (No Diagnostic Substances)
IMO,Imperial Oil Limited Common Stock,$50.14,-0.53,-1.046%,29289417281.00,Canada,1929,431951,,
INCY,Incyte Corp. Common Stock,$72.01,-0.85,-1.167%,16055710946.00,United States,,1514267,Health Care,Biotechnology: Commercial Physical & Biological Resarch
INDB,Independent Bank Corp. Common Stock,$70.59,-0.66,-0.926%,3221814990.00,United States,,658815,Finance,Major Banks
INFA,Informatica Inc. Class A Common Stock,$15.74,-0.18,-1.131%,4466988752.00,,2021,542891,Technology,EDP Services
INFY,Infosys Limited American Depositary Shares,$17.68,-0.04,-0.226%,73702167299.00,India,,6763850,Technology,EDP Services
ING,ING Group N.V. Common Stock,$12.98,-0.53,-3.923%,47128613085.00,Netherlands,1997,7488439,Finance,Commercial Banks
INGR,Ingredion Incorporated Common Stock,$95.88,-1.62,-1.662%,6298736405.00,United States,,211391,Consumer Staples,Farming/Seeds/Milling
INMD,InMode Ltd. Ordinary Shares,$31.11,-1.40,-4.306%,2584336228.00,Israel,2019,1660715,Health Care,Biotechnology: Electromedical & Electrotherapeutic Apparatus
INSM,Insmed Incorporated Common Stock,$17.98,-1.02,-5.368%,2435873026.00,United States,,2109149,Health Care,Biotechnology: Pharmaceutical Preparations
INSP,Inspire Medical Systems Inc. Common Stock,$229.06,-14.01,-5.764%,6653823297.00,United States,2018,330078,Health Care,Biotechnology: Electromedical & Electrotherapeutic Apparatus
INST,Instructure Holdings Inc. Common Stock,$23.45,-0.62,-2.576%,3351405526.00,,2021,185434,Technology,Computer Software: Prepackaged Software
INSW,International Seaways Inc. Common Stock ,$47.46,-1.71,-3.478%,2329261718.00,,2016,1082862,Technology,Semiconductors
INTA,Intapp Inc. Common Stock,$38.73,-1.52,-3.776%,2469107369.00,United States,2021,362025,Technology,Computer Software: Prepackaged Software
INTC,Intel Corporation Common Stock,$27.22,0.78,2.95%,112609140000.00,United States,,65168800,Technology,Semiconductors
INTU,Intuit Inc. Common Stock,$392.61,-11.97,-2.959%,110294101664.00,United States,1993,2855248,Technology,Computer Software: Prepackaged Software
INVH,Invitation Homes Inc. Common Stock,$30.26,-1.01,-3.23%,18501308419.00,United States,2017,5297153,Real Estate,Real Estate Investment Trusts
IONS,Ionis Pharmaceuticals Inc. Common Stock,$33.96,-0.80,-2.301%,4824029411.00,United States,,765372,Health Care,Biotechnology: Pharmaceutical Preparations
IOSP,Innospec Inc. Common Stock,$101.31,-2.84,-2.727%,5017858365.00,United States,,99465,Industrials,Industrial Specialties
IOT,Samsara Inc. Class A Common Stock,$19.36,-0.89,-4.395%,10045436320.00,,2021,4162048,Technology,Retail: Computer Software & Peripheral Equipment
IP,International Paper Company Common Stock,$35.52,-0.68,-1.878%,12434996503.00,United States,,2486457,Industrials,Containers/Packaging
IPAR,Inter Parfums Inc. Common Stock,$133.73,-0.07,-0.052%,4262727331.00,United States,,211308,Consumer Discretionary,Package Goods/Cosmetics
IPG,Interpublic Group of Companies Inc. (The) Common Stock,$33.77,-0.48,-1.401%,13120479727.00,United States,,3559961,Consumer Discretionary,Advertising
IPGP,IPG Photonics Corporation Common Stock,$118.13,-2.66,-2.202%,5686572299.00,United States,2006,236201,Technology,Semiconductors
IQ,iQIYI Inc. American Depositary Shares,$7.31,0.12,1.669%,6917589478.00,China,2018,9881842,Technology,Internet and Information Services
IQV,IQVIA Holdings Inc. Common Stock,$197.26,-5.67,-2.794%,36635644218.00,United States,2013,2650179,Health Care,Managed Health Care
IR,Ingersoll Rand Inc. Common Stock,$55.74,-2.40,-4.128%,22581261155.00,United States,2017,4381140,Industrials,Industrial Machinery/Components
IRDM,Iridium Communications Inc Common Stock,$58.69,-0.70,-1.179%,7392986973.00,United States,,794369,Consumer Discretionary,Telecommunications Equipment
IRM,Iron Mountain Incorporated (Delaware)Common Stock REIT,$51.33,-1.49,-2.821%,14922351519.00,United States,,1225586,Real Estate,Real Estate Investment Trusts
IRT,Independence Realty Trust Inc. Common Stock,$16.66,-0.58,-3.364%,3732921900.00,United States,2013,3151503,Real Estate,Real Estate Investment Trusts
IRTC,iRhythm Technologies Inc. Common Stock,$107.27,-8.04,-6.973%,3229993883.00,United States,2016,728179,Health Care,Medical/Dental Instruments
ISEE,IVERIC bio Inc. Common Stock,$21.56,-1.22,-5.356%,2890609611.00,United States,2013,3092964,Health Care,Biotechnology: Pharmaceutical Preparations
ISRG,Intuitive Surgical Inc. Common Stock,$224.75,-3.82,-1.671%,78750080355.00,United States,2000,1778469,Health Care,Medical/Dental Instruments
IT,Gartner Inc. Common Stock,$314.33,-17.99,-5.413%,24851116826.00,United States,1993,685941,Finance,Diversified Commercial Services
ITCB,Itau CorpBanca American Depositary Shares (each representing 1500 shares of Common Stock no par value),$3.59,-0.0086,-0.239%,2329952771.00,Chile,,90504,Finance,Commercial Banks
ITCI,Intra-Cellular Therapies Inc. Common Stock,$44.00,-0.24,-0.542%,4167022376.00,United States,,895601,Health Care,Biotechnology: Pharmaceutical Preparations
ITGR,Integer Holdings Corporation Common Stock,$73.14,-1.58,-2.115%,2423200828.00,United States,,328903,Health Care,Medical/Dental Instruments
ITRI,Itron Inc. Common Stock,$52.825,-1.095,-2.031%,2386527480.00,United States,1993,368737,Industrials,Electrical Products
ITT,ITT Inc. Common Stock ,$86.47,-3.18,-3.547%,7151069000.00,United States,2011,848232,Industrials,Fluid Controls
ITUB,Itau Unibanco Banco Holding SA American Depositary Shares (Each repstg 500 Preferred shares),$4.56,-0.20,-4.202%,44691951970.00,Brazil,,32393988,Finance,Major Banks
ITW,Illinois Tool Works Inc. Common Stock,$230.27,-4.52,-1.925%,70248040828.00,United States,,1231297,Industrials,Industrial Machinery/Components
IVZ,Invesco Ltd Common Stock,$16.41,-0.62,-3.641%,7463015417.00,United States,,7448364,Finance,Investment Managers
IX,Orix Corp Ads Common Stock,$87.02,-1.38,-1.561%,20009013490.00,Japan,,18472,Finance,Diversified Financial Services
J,Jacobs Solutions Inc. Common Stock,$115.11,-2.84,-2.408%,14586063044.00,,2022,895419,Industrials,Oilfield Services/Equipment
JAMF,Jamf Holding Corp. Common Stock,$19.19,-0.52,-2.638%,2329422997.00,United States,2020,1046724,Technology,Computer Software: Prepackaged Software
JAZZ,Jazz Pharmaceuticals plc Common Stock (Ireland),$134.06,-3.69,-2.679%,8441264859.00,Ireland,2007,648261,Health Care,Biotechnology: Pharmaceutical Preparations
JBHT,J.B. Hunt Transport Services Inc. Common Stock,$175.45,-4.16,-2.316%,18201709350.00,United States,,783602,Industrials,Trucking Freight/Courier Services
JBL,Jabil Inc. Common Stock,$81.91,-1.46,-1.751%,10916560492.00,United States,1993,1088615,Technology,Electrical Products
JBLU,JetBlue Airways Corporation Common Stock,$7.53,-0.14,-1.825%,2438798433.00,United States,2002,12883159,Consumer Discretionary,Air Freight/Delivery Services
JBT,John Bean Technologies Corporation Common Stock,$105.02,-2.50,-2.325%,3345768958.00,United States,,269106,Industrials,Diversified Manufacture
JCI,Johnson Controls International plc Ordinary Share,$61.46,-1.84,-2.907%,42233689087.00,Switzerland,,4253245,Industrials,Industrial Machinery/Components
JD,JD.com Inc. American Depositary Shares,$40.47,-1.21,-2.903%,63355785000.00,China,2014,15467919,Consumer Discretionary,Catalog/Specialty Distribution
JEF,Jefferies Financial Group Inc. Common Stock,$33.02,-1.51,-4.373%,7514458149.00,United States,,1826738,Finance,Investment Bankers/Brokers/Service
JHG,Janus Henderson Group plc Ordinary Shares,$25.48,-0.88,-3.338%,4220963419.00,,2017,1185369,Finance,Investment Managers
JHX,James Hardie Industries plc American Depositary Shares (Ireland),$20.23,-0.28,-1.365%,8987104712.00,Ireland,,74153,Industrials,Building Materials
JJSF,J & J Snack Foods Corp. Common Stock,$139.46,-1.53,-1.085%,2681722362.00,United States,1986,63285,Consumer Staples,Specialty Foods
JKHY,Jack Henry & Associates Inc. Common Stock,$158.08,-4.73,-2.905%,11538374124.00,United States,1985,638227,Technology,Retail: Computer Software & Peripheral Equipment
JKS,JinkoSolar Holding Company Limited American Depositary Shares (each representing 4 Common Shares),$48.98,-7.18,-12.785%,2455049422.00,China,2010,3679621,Technology,Semiconductors
JLL,Jones Lang LaSalle Incorporated Common Stock,$154.09,-9.03,-5.536%,7313506487.00,United States,,452102,Finance,Real Estate
JNJ,Johnson & Johnson Common Stock,$151.61,0.37,0.245%,394835846398.00,United States,,8502039,Health Care,Biotechnology: Pharmaceutical Preparations
JNPR,Juniper Networks Inc. Common Stock,$30.80,-0.26,-0.837%,9977961501.00,United States,1999,2988900,Technology,Computer peripheral equipment
JOBY,Joby Aviation Inc. Common Stock,$3.96,-0.06,-1.493%,2462056257.00,United States,2020,2972880,Consumer Discretionary,Aerospace
JOE,St. Joe Company (The) Common Stock,$39.81,-1.30,-3.162%,2322337887.00,United States,,196116,Real Estate,Homebuilding
JPM,JP Morgan Chase & Co. Common Stock,$133.65,3.31,2.54%,392169195000.00,United States,,37575546,Finance,Major Banks
JWN,Nordstrom Inc. Common Stock,$18.24,-0.60,-3.185%,2919883332.00,United States,,4378661,Consumer Discretionary,Clothing/Shoe/Accessory Stores
JXN,Jackson Financial Inc. Class A Common Stock ,$40.02,-1.14,-2.77%,3323139699.00,,2021,1459493,Finance,Life Insurance
K,Kellogg Company Common Stock,$63.89,-0.23,-0.359%,21850380000.00,United States,,1824378,Consumer Staples,Packaged Foods
KAI,Kadant Inc Common Stock,$207.57,-6.07,-2.841%,2421013660.00,United States,1992,65946,Technology,Industrial Machinery/Components
KB,KB Financial Group Inc,$37.12,-0.49,-1.303%,14463226515.00,South Korea,,186859,Finance,Commercial Banks
KBH,KB Home Common Stock,$34.62,-0.93,-2.616%,2907747613.00,United States,1986,1636156,,
KBR,KBR Inc. Common Stock,$53.04,-1.11,-2.05%,7243772993.00,United States,2006,1381125,Industrials,Oilfield Services/Equipment
KD,Kyndryl Holdings Inc. Common Stock,$14.60,-0.58,-3.821%,3321573584.00,,2021,1511656,Technology,EDP Services
KDP,Keurig Dr Pepper Inc. Common Stock,$34.32,-0.24,-0.694%,48605744856.00,United States,,6530140,Consumer Staples,Beverages (Production/Distribution)
KEP,Korea Electric Power Corporation Common Stock,$6.58,0.04,0.612%,8448247253.00,South Korea,1994,371145,Industrials,Electrical Products
KEX,Kirby Corporation Common Stock,$70.64,-1.69,-2.337%,4231336000.00,United States,,280749,Consumer Discretionary,Marine Transportation
KEY,KeyCorp Common Stock,$15.66,-0.41,-2.551%,14615869500.00,United States,,42332378,Finance,Major Banks
KEYS,Keysight Technologies Inc. Common Stock,$154.51,-2.91,-1.849%,27555945964.00,United States,2014,859166,Industrials,Industrial Machinery/Components
KFY,Korn Ferry Common Stock,$54.77,-1.81,-3.199%,2886923962.00,United States,1999,383507,Consumer Discretionary,Diversified Commercial Services
KGC,Kinross Gold Corporation Common Stock,$3.50,0.08,2.339%,4286800000.00,Canada,2001,15340212,,
KHC,The Kraft Heinz Company Common Stock,$37.94,0.15,0.397%,46476628123.00,United States,,5349458,Consumer Staples,Farming/Seeds/Milling
KIM,Kimco Realty Corporation (HC) Common Stock,$18.78,-0.80,-4.086%,11615121351.00,United States,,4766840,Real Estate,Real Estate Investment Trusts
KKR,KKR & Co. Inc. Common Stock,$50.31,-4.14,-7.603%,43322468148.00,United States,,10674049,Finance,Investment Managers
KLAC,KLA Corporation Common Stock,$367.51,-10.96,-2.896%,50892698068.00,United States,1980,1141868,Technology,Electronic Components
KLIC,Kulicke and Soffa Industries Inc. Common Stock,$51.37,-0.81,-1.552%,2912056344.00,Singapore,,474103,Technology,Semiconductors
KMB,Kimberly-Clark Corporation Common Stock,$122.34,-0.27,-0.22%,41290649077.00,United States,,1347439,Consumer Discretionary,Paper
KMI,Kinder Morgan Inc. Common Stock,$16.77,-0.37,-2.159%,37699014066.00,United States,2011,15624704,Utilities,Natural Gas Distribution
KMPR,Kemper Corporation,$57.76,-1.42,-2.399%,3694325152.00,United States,,486829,Finance,Property-Casualty Insurers
