Symbol,Name,Last Sale,Net Change,% Change,Market Cap,Country,IPO Year,Volume,Sector,Industry
PLTK,Playtika Holding Corp. Common Stock,$9.12,-0.19,-2.041%,3293454765.00,Israel,2021,991545,Technology,EDP Services
PLTR,Palantir Technologies Inc. Class A Common Stock,$7.35,-0.34,-4.421%,15289432846.00,,2020,41845322,Technology,Retail: Computer Software & Peripheral Equipment
PLUG,Plug Power Inc. Common Stock,$12.35,-0.67,-5.146%,7198869599.00,United States,1999,23184663,Consumer Discretionary,Electrical Products
PLXS,Plexus Corp. Common Stock,$95.69,-1.62,-1.665%,2650850598.00,United States,,132164,Technology,Electrical Products
PM,Philip Morris International Inc Common Stock,$98.35,-0.61,-0.616%,152465405223.00,United States,,3970761,Health Care, Medicinal Chemicals and Botanical Products
PNC,PNC Financial Services Group Inc. (The) Common Stock,$137.16,-0.71,-0.515%,55001160000.00,United States,,6955722,Finance,Major Banks
PNFP,Pinnacle Financial Partners Inc. Common Stock,$59.89,-2.31,-3.714%,4578878751.00,United States,,1877649,Finance,Major Banks
PNM,PNM Resources Inc. (Holding Co.) Common Stock,$49.00,-0.09,-0.183%,4205908826.00,United States,,945878,Utilities,Electric Utilities: Central
PNR,Pentair plc. Ordinary Share,$52.68,-1.71,-3.144%,8665773289.00,Switzerland,,2432273,Industrials,Industrial Machinery/Components
PNW,Pinnacle West Capital Corporation Common Stock,$74.01,-1.65,-2.181%,8373506424.00,United States,,707415,Utilities,Electric Utilities: Central
PODD,Insulet Corporation Common Stock,$280.36,-2.76,-0.975%,19470638373.00,United States,2007,759350,Health Care,Medical/Dental Instruments
POOL,Pool Corporation Common Stock,$348.41,-0.63,-0.18%,13605625817.00,United States,1995,390266,Industrials,Industrial Machinery/Components
POR,Portland General Electric Co Common Stock,$45.62,-0.91,-1.956%,4074448339.00,United States,,581234,Utilities,Electric Utilities: Central
POST,Post Holdings Inc. Common Stock,$87.21,-0.60,-0.683%,5139786147.00,United States,2012,540181,Consumer Discretionary,Food Distributors
POWI,Power Integrations Inc. Common Stock,$81.35,-0.72,-0.877%,4635871462.00,United States,1997,310063,Technology,Semiconductors
PPBI,Pacific Premier Bancorp Inc,$27.70,-0.55,-1.947%,2632102752.00,United States,,1451298,Finance,Major Banks
PPC,Pilgrim's Pride Corporation Common Stock,$23.78,0.08,0.338%,5623241500.00,United States,,866202,Consumer Staples,Meat/Poultry/Fish
PPG,PPG Industries Inc. Common Stock,$126.00,-1.40,-1.099%,29632679118.00,United States,,2400981,Consumer Discretionary,Paints/Coatings
PPL,PPL Corporation Common Stock,$26.25,-0.33,-1.242%,19337793668.00,United States,,6167378,Utilities,Electric Utilities: Central
PR,Permian Resources Corporation Class A Common Stock,$10.74,-0.22,-2.007%,3098495789.00,United States,2022,14436833,Energy,Oil & Gas Production
PRFT,Perficient Inc. Common Stock,$67.86,-3.32,-4.664%,2349886210.00,United States,1999,252501,Technology,EDP Services
PRGO,Perrigo Company plc Ordinary Shares,$35.85,-0.50,-1.376%,4826834894.00,United States,,1445043,Health Care,Biotechnology: Pharmaceutical Preparations
PRGS,Progress Software Corporation Common Stock (DE),$56.20,-0.46,-0.812%,2436005129.00,United States,1991,327678,Technology,Computer Software: Prepackaged Software
PRI,Primerica Inc. Common Stock,$168.49,-3.86,-2.24%,6216972663.00,United States,2010,218838,Finance,Life Insurance
PRMW,Primo Water Corporation Common Stock,$14.58,-0.47,-3.123%,2329714901.00,Canada,,774452,Consumer Staples,Farming/Seeds/Milling
PROK,ProKidney Corp. Class A Ordinary Shares,$11.97,-0.13,-1.074%,2780202378.00,United States,2021,295907,Health Care,Biotechnology: Biological Products (No Diagnostic Substances)
PRTA,Prothena Corporation plc Ordinary Shares,$47.98,-2.18,-4.346%,2477042637.00,United States,,850102,Health Care,Biotechnology: Pharmaceutical Preparations
PRU,Prudential Financial Inc. Common Stock,$88.52,-2.18,-2.404%,32398320000.00,United States,2001,4192108,Finance,Life Insurance
PRVA,Privia Health Group Inc. Common Stock,$25.81,-1.91,-6.89%,2950045472.00,United States,2021,1177044,Technology,Retail: Computer Software & Peripheral Equipment
PSA,Public Storage Common Stock,$281.46,-14.24,-4.816%,49435180686.00,United States,,1306661,Real Estate,Real Estate Investment Trusts
PSEC,Prospect Capital Corporation Common Stock,$6.78,-0.20,-2.865%,2708168405.00,United States,2004,4469074,Finance,Finance/Investors Services
PSMT,PriceSmart Inc. Common Stock,$67.64,-1.21,-1.757%,2100284026.00,United States,,84336,Consumer Discretionary,Department/Specialty Retail Stores
PSN,Parsons Corporation Common Stock,$43.19,-0.46,-1.054%,4522402873.00,,2019,453113,Technology,EDP Services
PSNY,Polestar Automotive Holding UK PLC Class A ADS,$4.50,-0.09,-1.961%,9492203462.00,Sweden,,2657782,Consumer Discretionary,Auto Manufacturing
PSO,Pearson Plc Common Stock,$10.17,-0.08,-0.78%,7279201674.00,United Kingdom,,614672,Consumer Discretionary,Books
PSTG,Pure Storage Inc. Class A Common Stock,$23.45,-0.32,-1.346%,7095633094.00,,2015,5929804,Technology,Electronic Components
PSX,Phillips 66 Common Stock,$101.22,0.08,0.079%,47168520000.00,United States,,4367082,Energy,Integrated oil Companies
PTC,PTC Inc. Common Stock,$118.38,-2.18,-1.808%,13999997971.00,United States,,535679,Technology,Computer Software: Prepackaged Software
PTCT,PTC Therapeutics Inc. Common Stock,$44.23,-1.71,-3.722%,3227787483.00,United States,2013,1094438,Health Care,Biotechnology: Pharmaceutical Preparations
PTEN,Patterson-UTI Energy Inc. Common Stock,$13.15,-0.16,-1.202%,2809574927.00,United States,1993,2476332,Energy,Oil & Gas Production
PTON,Peloton Interactive Inc. Class A Common Stock,$11.78,-0.96,-7.535%,4076118557.00,United States,2019,17313906,Consumer Discretionary,Other Consumer Services
PUK,Prudential Public Limited Company Common Stock,$28.96,-0.95,-3.176%,39815214563.00,United Kingdom,,874402,Finance,Life Insurance
PVH,PVH Corp. Common Stock,$74.99,-1.49,-1.948%,5351266153.00,United States,,771669,,
PWR,Quanta Services Inc. Common Stock,$157.35,-3.20,-1.993%,22485496897.00,United States,,1695700,Industrials,Engineering & Construction
PWSC,PowerSchool Holdings Inc. Class A Common Stock,$18.79,-0.60,-3.094%,3747135603.00,United States,2021,818253,Technology,Computer Software: Prepackaged Software
PXD,Pioneer Natural Resources Company Common Stock,$198.78,-3.24,-1.604%,47229876146.00,United States,,2543594,Energy,Oil & Gas Production
PYCR,Paycor HCM Inc. Common Stock,$22.68,-1.12,-4.706%,4001615700.00,United States,2021,726720,Technology,Computer Software: Prepackaged Software
PYPL,PayPal Holdings Inc. Common Stock,$73.43,-2.50,-3.293%,83076741272.00,United States,,13118803,Consumer Discretionary,Business Services
PZZA,Papa John's International Inc. Common Stock,$77.65,-3.15,-3.899%,2743231080.00,United States,1993,486175,Consumer Discretionary,Restaurants
QCOM,QUALCOMM Incorporated Common Stock,$115.19,-2.03,-1.732%,128436850000.00,United States,1991,6880002,Technology,Computer peripheral equipment
QDEL,QuidelOrtho Corporation Common Stock,$83.26,-3.10,-3.59%,5498936507.00,United States,,638295,Health Care,Medical/Dental Instruments
QFIN,360 DigiTech Inc. American Depositary Shares,$17.47,-0.54,-2.998%,2785527752.00,China,2018,2074464,Finance,Finance: Consumer Services
QGEN,Qiagen N.V. Common Shares ,$45.94,0.14,0.306%,10461273040.00,Netherlands,,869875,Health Care,Biotechnology: Biological Products (No Diagnostic Substances)
QLYS,Qualys Inc. Common Stock,$117.84,-1.41,-1.182%,4476509337.00,United States,2012,254265,Technology,EDP Services
QRVO,Qorvo Inc. Common Stock,$95.33,-2.21,-2.266%,9522438389.00,United States,,1199280,Industrials,Industrial Machinery/Components
QS,QuantumScape Corporation Class A Common Stock,$7.35,0.03,0.41%,3204286508.00,United States,2020,5451317,Consumer Discretionary,Auto Parts:O.E.M.
QSR,Restaurant Brands International Inc. Common Shares,$60.53,-0.49,-0.803%,18591331651.00,Canada,2014,2238473,,
R,Ryder System Inc. Common Stock,$90.98,-2.63,-2.81%,4211440363.00,United States,,261227,Consumer Discretionary,Rental/Leasing Companies
RACE,Ferrari N.V. Common Shares,$261.23,-3.45,-1.303%,47652744060.00,,2015,476414,Consumer Discretionary,Auto Manufacturing
RARE,Ultragenyx Pharmaceutical Inc. Common Stock,$38.76,-1.16,-2.906%,2721598866.00,United States,2014,919355,Health Care,Biotechnology: Pharmaceutical Preparations
RBA,Ritchie Bros. Auctioneers Incorporated Common Stock,$56.14,-1.97,-3.39%,6239342000.00,Canada,,16642294,,
RBC,RBC Bearings Incorporated Common Stock,$222.03,-7.78,-3.385%,6443736454.00,United States,2022,215504,Industrials,Metal Fabrications
RBLX,Roblox Corporation Class A Common Stock,$40.05,0.11,0.275%,24217205795.00,United States,2021,13833624,Technology,EDP Services
RCI,Rogers Communication Inc. Common Stock,$44.87,0.68,1.539%,22655998974.00,Canada,,274631,,
RCL,D/B/A Royal Caribbean Cruises Ltd. Common Stock,$66.86,-1.39,-2.037%,17065260619.00,United States,1993,5225952,,
RCM,R1 RCM Inc. Common Stock,$13.32,-0.27,-1.987%,5549934017.00,United States,,2642303,Consumer Discretionary,Other Consumer Services
RDN,Radian Group Inc. Common Stock,$21.18,-0.72,-3.288%,3326446080.00,United States,,3549299,Finance,Property-Casualty Insurers
RDY,Dr. Reddy's Laboratories Ltd Common Stock,$53.43,-0.13,-0.243%,8874852301.00,India,,102273,Health Care,Biotechnology: Pharmaceutical Preparations
RE,Everest Re Group Ltd. Common Stock,$356.90,-11.26,-3.058%,13990480000.00,Bermuda,,566139,Finance,Property-Casualty Insurers
REG,Regency Centers Corporation Common Stock,$58.58,-2.03,-3.349%,10035218364.00,United States,1993,1103952,Real Estate,Real Estate Investment Trusts
REGN,Regeneron Pharmaceuticals Inc. Common Stock,$747.00,3.25,0.437%,81666172404.00,United States,1991,504786,Health Care,Biotechnology: Pharmaceutical Preparations
RELX,RELX PLC PLC American Depositary Shares (Each representing One Ordinary Share),$30.07,-0.44,-1.442%,57403752625.00,United Kingdom,2015,892074,Consumer Discretionary,Business Services
RELY,Remitly Global Inc. Common Stock,$15.17,-0.16,-1.044%,2588969892.00,United States,2021,2454390,Technology,Computer Software: Prepackaged Software
RETA,Reata Pharmaceuticals Inc. Class A Common Stock,$82.96,-1.64,-1.939%,3039957619.00,United States,2016,1104302,Health Care,Biotechnology: Pharmaceutical Preparations
REXR,Rexford Industrial Realty Inc. Common Stock,$56.41,-2.61,-4.422%,11097756986.00,United States,2013,1393283,Real Estate,Real Estate Investment Trusts
REYN,Reynolds Consumer Products Inc. Common Stock,$26.51,-0.13,-0.488%,5563459064.00,United States,2020,336728,Industrials,Office Equipment/Supplies/Services
REZI,Resideo Technologies Inc. Common Stock ,$17.23,-0.48,-2.71%,2515580000.00,,2018,840881,Technology,Security Systems Services
RF,Regions Financial Corporation Common Stock,$20.28,-0.38,-1.839%,18950556890.00,United States,,23657191,Finance,Major Banks
RGA,Reinsurance Group of America Incorporated Common Stock,$133.74,-4.60,-3.325%,8917248240.00,United States,,501558,Finance,Life Insurance
RGEN,Repligen Corporation Common Stock,$166.27,-7.33,-4.222%,9232048473.00,United States,1986,573530,Health Care,Medical/Dental Instruments
RGLD,Royal Gold Inc. Common Stock,$113.44,0.53,0.469%,7446667838.00,United States,,643703,Industrials,Consumer Electronics/Appliances
RH,RH Common Stock,$259.73,-7.38,-2.763%,5990468562.00,United States,2012,1008564,Consumer Discretionary,Other Specialty Stores
RHI,Robert Half International Inc. Common Stock,$77.41,-1.43,-1.814%,8336940653.00,United States,,947737,Consumer Discretionary,Diversified Commercial Services
RHP,Ryman Hospitality Properties Inc. (REIT),$90.13,-2.11,-2.288%,4971870392.00,United States,,270077,Real Estate,Real Estate Investment Trusts
RIG,Transocean Ltd (Switzerland) Common Stock,$6.68,0.02,0.30%,4822214692.00,Switzerland,,26435901,Energy,Oil & Gas Production
RIO,Rio Tinto Plc Common Stock,$67.54,-0.68,-0.997%,109479424839.00,Australia,2002,3333370,Basic Materials,Metal Mining
RITM,Rithm Capital Corp. Common Stock,$8.21,-0.33,-3.864%,3889326584.00,United States,,6188021,Real Estate,Real Estate Investment Trusts
RIVN,Rivian Automotive Inc. Class A Common Stock,$14.16,-0.37,-2.546%,13040734199.00,United States,2021,42285996,Consumer Discretionary,Auto Manufacturing
RJF,Raymond James Financial Inc. Common Stock,$94.85,-5.27,-5.264%,20426092715.00,United States,,2824332,Finance,Investment Bankers/Brokers/Service
RL,Ralph Lauren Corporation Common Stock,$113.33,-1.37,-1.194%,7477442569.00,United States,1997,781294,Consumer Discretionary,Apparel
RLI,RLI Corp. Common Stock (DE),$131.99,-0.34,-0.257%,6001585300.00,United States,,325515,Finance,Property-Casualty Insurers
RLX,RLX Technology Inc. American Depositary Shares each representing the right to receive one (1) Class A ordinary share,$2.52,0.33,15.068%,3900687903.00,,2021,24588883,Health Care, Medicinal Chemicals and Botanical Products
RMBS,Rambus Inc. Common Stock,$41.30,-1.45,-3.392%,4439007013.00,United States,1997,1115437,Technology,Semiconductors
RMD,ResMed Inc. Common Stock,$205.86,-6.26,-2.951%,30242771760.00,United States,,579716,Health Care,Medical/Dental Instruments
RNG,RingCentral Inc. Class A Common Stock,$32.84,-1.02,-3.012%,3153435976.00,,2013,2210993,Technology,EDP Services
RNR,RenaissanceRe Holdings Ltd. Common Stock,$194.30,-8.07,-3.988%,8494743928.00,Bermuda,,701564,Finance,Property-Casualty Insurers
ROG,Rogers Corporation Common Stock,$154.25,-5.59,-3.497%,2901731565.00,United States,1960,219946,Technology,Industrial Machinery/Components
ROIV,Roivant Sciences Ltd. Common Shares,$7.65,-0.04,-0.52%,5801969228.00,United Kingdom,,2044998,Health Care,Biotechnology: Pharmaceutical Preparations
ROK,Rockwell Automation Inc. Common Stock,$289.07,-9.85,-3.295%,33180161954.00,United States,,552213,Industrials,Industrial Machinery/Components
ROKU,Roku Inc. Class A Common Stock,$59.99,-0.53,-0.876%,8405159787.00,United States,2017,8402313,Telecommunications,Cable & Other Pay Television Services
ROL,Rollins Inc. Common Stock,$34.67,-0.14,-0.402%,17067349438.00,United States,,1550093,Consumer Discretionary,Industrial Specialties
ROP,Roper Technologies Inc. Common Stock,$420.33,-2.47,-0.584%,44576859858.00,United States,1992,847911,Technology,Computer Software: Prepackaged Software
ROST,Ross Stores Inc. Common Stock,$104.17,-1.39,-1.317%,35873128008.00,United States,1985,2458141,Consumer Discretionary,Clothing/Shoe/Accessory Stores
RPD,Rapid7 Inc. Common Stock,$42.10,-3.84,-8.359%,2493832232.00,United States,2015,1385408,Technology,Computer Software: Prepackaged Software
RPM,RPM International Inc. Common Stock,$85.31,-1.72,-1.976%,11012671227.00,United States,,621209,Consumer Discretionary,Paints/Coatings
RPRX,Royalty Pharma plc Class A Ordinary Shares ,$33.10,-0.42,-1.253%,14668795593.00,United States,2020,2215631,Health Care,Biotechnology: Pharmaceutical Preparations
RRC,Range Resources Corporation Common Stock,$25.68,-0.65,-2.469%,6205190780.00,United States,,3461056,Energy,Oil & Gas Production
RRR,Red Rock Resorts Inc. Class A Common Stock,$43.20,-0.98,-2.218%,2505618101.00,United States,2016,454202,Consumer Discretionary,Recreational Games/Products/Toys
RRX,Regal Rexnord Corporation Common Stock,$150.92,-4.81,-3.089%,9983544990.00,United States,1976,605256,Consumer Discretionary,Metal Fabrications
RS,Reliance Steel & Aluminum Co. Common Stock (DE),$249.63,-4.43,-1.744%,14674998810.00,United States,1994,804173,Industrials,Steel/Iron Ore
RSG,Republic Services Inc. Common Stock,$127.05,-1.27,-0.99%,40147918919.00,United States,1998,2116482,Utilities,Environmental Services
RTO,Rentokil Initial plc American Depositary Shares (each representing five (5) Ordinary Shares),$30.70,-0.71,-2.26%,15473044894.00,,2022,306976,Consumer Discretionary,Industrial Specialties
RTX,Raytheon Technologies Corporation Common Stock,$96.00,0.07,0.073%,140635640064.00,United States,,6338834,Industrials,Military/Government/Technical
RUM,Rumble Inc. Class A Common Stock,$8.88,-0.33,-3.583%,2478674196.00,United States,2021,969073,Technology,Computer Software: Prepackaged Software
RUN,Sunrun Inc. Common Stock,$20.73,-2.91,-12.31%,4417640095.00,United States,2015,30515228,Industrials,Building Products
RUSHA,Rush Enterprises Inc. Common Stock Cl A,$54.54,-0.50,-0.908%,2968527445.00,United States,,221064,Consumer Discretionary,Other Specialty Stores
RUSHB,Rush Enterprises Inc. Class B,$57.39,-0.09,-0.157%,3123648516.00,United States,,10018,Consumer Discretionary,Other Specialty Stores
RVNC,Revance Therapeutics Inc. Common Stock,$28.63,-2.34,-7.556%,2355492653.00,United States,2014,1797179,Health Care,Biotechnology: Pharmaceutical Preparations
RXDX,Prometheus Biosciences Inc. Common Stock,$114.37,-4.62,-3.883%,5316798363.00,United States,2021,584095,Health Care,Biotechnology: Pharmaceutical Preparations
RXO,RXO Inc. Common Stock,$20.12,-0.69,-3.316%,2341968000.00,,2022,866005,,
RY,Royal Bank Of Canada Common Stock,$96.24,-1.64,-1.676%,133087074558.00,Canada,,1594325,,
RYAAY,Ryanair Holdings plc American Depositary Shares,$90.70,-1.98,-2.136%,20655374484.00,Ireland,1997,510298,Consumer Discretionary,Air Freight/Delivery Services
RYAN,Ryan Specialty Holdings Inc. Class A Common Stock,$36.76,-1.30,-3.416%,4130555486.00,,2021,880760,,
RYN,Rayonier Inc. REIT Common Stock,$32.35,-0.52,-1.582%,4764593113.00,United States,,654954,Real Estate,Real Estate Investment Trusts
S,SentinelOne Inc. Class A Common Stock,$13.91,-0.68,-4.661%,3932046654.00,United States,2021,12188235,Technology,EDP Services
SAGE,Sage Therapeutics Inc. Common Stock,$39.56,-3.51,-8.15%,2362428572.00,United States,2014,1058521,Health Care,Biotechnology: Pharmaceutical Preparations
SAH,Sonic Automotive Inc. Common Stock,$55.98,-1.44,-2.508%,2017658142.00,United States,1997,604677,Consumer Discretionary,Other Specialty Stores
SAIA,Saia Inc. Common Stock,$276.31,-4.35,-1.55%,7311843152.00,United States,,457078,Industrials,Trucking Freight/Courier Services
SAIC,SCIENCE APPLICATIONS INTERNATIONAL CORPORATION Common Stock,$103.75,-1.14,-1.087%,5667786555.00,,,239387,Technology,EDP Services
SAM,Boston Beer Company Inc. (The) Common Stock,$311.97,-11.13,-3.445%,3839105628.00,United States,,168335,Consumer Staples,Beverages (Production/Distribution)
SAN,Banco Santander S.A. Sponsored ADR (Spain),$3.73,-0.16,-4.113%,62509261957.00,Spain,,9597637,Finance,Commercial Banks
SANM,Sanmina Corporation Common Stock,$58.24,-1.41,-2.364%,3398750468.00,United States,1993,385265,Technology,Electrical Products
SAP,SAP  SE ADS,$115.46,-0.53,-0.457%,135042016000.00,Germany,,1005261,Technology,Computer Software: Prepackaged Software
SBAC,SBA Communications Corporation Class A Common Stock,$240.12,-3.65,-1.497%,25924684985.00,United States,1999,928962,Real Estate,Real Estate Investment Trusts
SBCF,Seacoast Banking Corporation of Florida Common Stock,$26.54,-0.32,-1.191%,2234162386.00,United States,,2020693,Finance,Major Banks
SBLK,Star Bulk Carriers Corp. Common Shares,$21.68,0.03,0.139%,2226284035.00,Greece,,1379350,Consumer Discretionary,Marine Transportation
SBNY,Signature Bank Common Stock,$70.00,-20.76,-22.874%,4405025310.00,United States,2004,21667348,Finance,Major Banks
SBRA,Sabra Health Care REIT Inc. Common Stock,$11.20,-0.37,-3.198%,2586937987.00,United States,,3024713,Real Estate,Real Estate Investment Trusts
SBS,Companhia de saneamento Basico Do Estado De Sao Paulo - Sabesp American Depositary Shares (Each repstg 250 Common Shares),$9.69,-0.41,-4.059%,6623208886.00,Brazil,2002,1205527,Utilities,Water Supply
SBSW,D/B/A Sibanye-Stillwater Limited ADS,$8.31,0.20,2.466%,5879819861.00,,,6529566,Basic Materials,Precious Metals
SBUX,Starbucks Corporation Common Stock,$99.38,-0.92,-0.917%,114217434000.00,United States,1992,6641015,Consumer Discretionary,Beverages - Non-Alcoholic
SCCO,Southern Copper Corporation Common Stock,$72.36,-0.97,-1.323%,55941405217.00,United States,,969971,Basic Materials,Metal Mining
SCHW,Charles Schwab Corporation (The) Common Stock,$58.70,-7.77,-11.689%,109577601136.00,United States,,88827233,Finance,Investment Bankers/Brokers/Service
SCI,Service Corporation International Common Stock,$64.63,-0.62,-0.95%,9891542328.00,United States,,1218550,Consumer Discretionary,Other Consumer Services
SCL,Stepan Company Common Stock,$96.64,-1.96,-1.988%,2148143878.00,United States,,67314,Consumer Discretionary,Package Goods/Cosmetics
SE,Sea Limited American Depositary Shares each representing one Class A Ordinary Share,$73.45,-4.12,-5.311%,41259653162.00,United States,2017,8535714,Technology,Computer Software: Prepackaged Software
SEAS,SeaWorld Entertainment Inc. Common Stock,$59.18,-2.31,-3.757%,3780804135.00,United States,2013,838072,Consumer Discretionary,Movies/Entertainment
SEB,Seaboard Corporation Common Stock,$3758.58,-26.44,-0.699%,4362880734.00,United States,1996,904,Industrials,Consumer Electronics/Appliances
SEDG,SolarEdge Technologies Inc. Common Stock,$304.32,-9.21,-2.938%,17082517505.00,Israel,2015,1132159,Technology,Semiconductors
SEE,Sealed Air Corporation Common Stock,$45.27,-1.89,-4.008%,6548646021.00,United States,,1108931,Industrials,Containers/Packaging
SEIC,SEI Investments Company Common Stock,$56.43,-1.53,-2.64%,7570761660.00,United States,1981,530744,Finance,Investment Bankers/Brokers/Service
SEM,Select Medical Holdings Corporation Common Stock,$25.01,-0.45,-1.767%,3175860211.00,United States,2009,611896,Health Care,Hospital/Nursing Management
SF,Stifel Financial Corporation Common Stock,$58.39,-4.46,-7.096%,6230269054.00,United States,,1443135,Finance,Investment Bankers/Brokers/Service
SFBS,ServisFirst Bancshares Inc. Common Stock,$62.77,-1.62,-2.516%,3410076100.00,United States,,401599,Finance,Major Banks
SFM,Sprouts Farmers Market Inc. Common Stock,$33.03,-0.49,-1.462%,3496307084.00,United States,2013,1963432,Consumer Discretionary,Specialty Foods
SFNC,Simmons First National Corporation Class A Common Stock,$19.46,-0.13,-0.664%,2472327887.00,United States,,922049,Finance,Major Banks
SGEN,Seagen Inc. Common Stock,$172.61,-1.03,-0.593%,32241712638.00,United States,2001,1075542,Health Care,Biotechnology: Biological Products (No Diagnostic Substances)
SGFY,Signify Health Inc. Class A Common Stock,$28.68,0.19,0.667%,6767012444.00,,2021,1573737,Technology,Retail: Computer Software & Peripheral Equipment
SGML,Sigma Lithium Corporation Common Shares,$34.18,0.15,0.441%,3537630000.00,Canada,,564870,Industrials,Industrial Machinery/Components
SGRY,Surgery Partners Inc. Common Stock,$30.29,-1.42,-4.478%,3713665922.00,United States,2015,701036,Health Care,Managed Health Care
SHAK,Shake Shack Inc. Class A Common Stock,$54.53,-1.52,-2.712%,2142210941.00,United States,2015,951063,Consumer Discretionary,Restaurants
SHC,Sotera Health Company Common Stock,$16.44,-0.30,-1.792%,4637945924.00,United States,2020,1724909,Health Care,Medical Specialities
SHEL,Royal Dutch Shell PLC American Depositary Shares (each representing two (2) Ordinary Shares) ,$60.36,-0.30,-0.495%,209420616582.00,Netherlands,2022,4493168,Energy,Oil & Gas Production
SHG,Shinhan Financial Group Co Ltd American Depositary Shares,$26.86,-0.29,-1.068%,13665790967.00,South Korea,,125682,Finance,Major Banks
SHLS,Shoals Technologies Group Inc. Class A Common Stock,$21.84,-1.36,-5.862%,2522702626.00,United States,2021,11286376,Technology,Semiconductors
SHO,Sunstone Hotel Investors Inc. Sunstone Hotel Investors Inc. Common Shares,$9.74,-0.18,-1.815%,2049291325.00,United States,2004,2907658,Real Estate,Real Estate Investment Trusts
SHOO,Steven Madden Ltd. Common Stock,$34.46,-0.34,-0.977%,2683864755.00,United States,1993,1022179,Consumer Discretionary,Shoe Manufacturing
SHOP,Shopify Inc. Class A Subordinate Voting Shares,$41.46,-1.54,-3.581%,52927979742.00,Canada,2015,22063677,,
SHW,Sherwin-Williams Company (The) Common Stock,$214.10,-3.09,-1.423%,55482605366.00,United States,,1677720,Consumer Discretionary,Paints/Coatings
SID,Companhia Siderurgica Nacional S.A. Common Stock,$3.05,-0.19,-5.864%,4231948343.00,Brazil,,5913601,Industrials,Steel/Iron Ore
SIG,Signet Jewelers Limited Common Shares,$70.67,-1.19,-1.656%,3211043815.00,Bermuda,,713289,Consumer Discretionary,Consumer Specialties
SIGI,Selective Insurance Group Inc. Common Stock,$94.66,-1.06,-1.107%,5711673742.00,United States,,284242,Finance,Property-Casualty Insurers
SIM,Grupo Simec S.A.B. de C.V. American Depositary Shares,$35.73,0.00,0.00%,5504038426.00,Mexico,1998,278,Industrials,Aluminum
SIMO,Silicon Motion Technology Corporation American Depositary Shares,$63.36,-1.22,-1.889%,2093769850.00,Taiwan,2005,450108,Technology,Semiconductors
SIRI,Sirius XM Holdings Inc. Common Stock,$3.67,-0.13,-3.421%,14278136622.00,United States,,21692255,Consumer Discretionary,Movies/Entertainment
SITC,SITE Centers Corp. Common Stock,$12.17,-0.45,-3.566%,2566081010.00,United States,,1541280,Real Estate,Real Estate Investment Trusts
SITE,SiteOne Landscape Supply Inc. Common Stock,$135.60,-7.86,-5.479%,6090649060.00,United States,2016,797867,,
SITM,SiTime Corporation Common Stock,$126.27,-8.15,-6.063%,2707164529.00,United States,2019,364130,Technology,Semiconductors
SIVB,SVB Financial Group Common Stock,$106.04,0.00,0.00%,6274586473.00,United States,,11485729,Finance,Major Banks
SIX,Six Flags Entertainment Corporation New Common Stock,$25.86,-1.30,-4.786%,2150427193.00,United States,,1773629,Consumer Discretionary,Movies/Entertainment
SJM,J.M. Smucker Company (The) New Common Stock,$147.88,-0.50,-0.337%,15769776947.00,United States,,814322,Consumer Staples,Packaged Foods
SJR,Shaw Communications Inc. Common Stock,$28.33,-0.03,-0.106%,14157542949.00,Canada,,1255261,,
SJW,SJW Group Common Stock (DE),$74.41,-0.58,-0.773%,2256060378.00,United States,1972,177745,Utilities,Water Supply
SKM,SK Telecom Co. Ltd. Common Stock,$19.71,-0.18,-0.905%,7754611222.00,South Korea,,449053,Telecommunications,Telecommunications Equipment
