Symbol,Name,Last Sale,Net Change,% Change,Market Cap,Country,IPO Year,Volume,Sector,Industry
CME,CME Group Inc. Class A Common Stock,$174.67,-2.80,-1.578%,62833710196.00,United States,2002,2024542,Finance,Investment Bankers/Brokers/Service
CMG,Chipotle Mexican Grill Inc. Common Stock,$1550.71,-0.39,-0.025%,42833474361.00,United States,2006,349306,Consumer Discretionary,Restaurants
CMI,Cummins Inc. Common Stock,$241.82,-8.76,-3.496%,34187364406.00,United States,,1049652,Industrials,Construction/Ag Equipment/Trucks
CMS,CMS Energy Corporation Common Stock,$58.08,-1.05,-1.776%,16916624446.00,United States,,1796903,Utilities,Power Generation
CNA,CNA Financial Corporation Common Stock,$39.80,-0.54,-1.339%,10781892794.00,United States,,205248,Finance,Property-Casualty Insurers
CNC,Centene Corporation Common Stock,$65.10,-0.44,-0.671%,35854085400.00,United States,,2948510,Health Care,Medical Specialities
CNHI,CNH Industrial N.V. Common Shares,$15.43,-0.73,-4.517%,20730332328.00,,2013,4843840,Industrials,Construction/Ag Equipment/Trucks
CNI,Canadian National Railway Company Common Stock,$115.46,-0.64,-0.551%,77637884993.00,Canada,,1376765,,
CNM,Core & Main Inc. Class A Common Stock,$22.11,-0.78,-3.408%,3811749208.00,,2021,1026700,Industrials,Industrial Machinery/Components
CNMD,CONMED Corporation Common Stock,$90.36,-5.77,-6.002%,2754390748.00,United States,1987,430996,Health Care,Biotechnology: Electromedical & Electrotherapeutic Apparatus
CNO,CNO Financial Group Inc. Common Stock,$22.77,-0.87,-3.68%,2603591704.00,United States,,1311673,Finance,Life Insurance
CNP,CenterPoint Energy Inc (Holding Co) Common Stock,$27.56,-0.32,-1.148%,17356977233.00,United States,,6398173,Utilities,Electric Utilities: Central
CNQ,Canadian Natural Resources Limited Common Stock,$56.42,-0.93,-1.622%,62458689020.00,Canada,,1566603,,
CNS,Cohen & Steers Inc Common Stock,$64.91,-3.30,-4.838%,3161528529.00,United States,2004,133373,Finance,Investment Managers
CNX,CNX Resources Corporation Common Stock,$15.14,-0.17,-1.11%,2575715634.00,United States,1999,3013196,Energy,Oil & Gas Production
CNXC,Concentrix Corporation Common Stock,$128.48,-6.82,-5.041%,6689830773.00,United States,,399728,Technology,Computer Software: Prepackaged Software
COF,Capital One Financial Corporation Common Stock,$98.19,-2.75,-2.724%,37439847000.00,United States,1994,5668781,Finance,Finance Companies
COHR,Coherent Corp. Common Stock,$38.54,-1.45,-3.626%,5355620955.00,United States,,1843631,Industrials,Industrial Machinery/Components
COIN,Coinbase Global Inc. Class A Common Stock,$53.44,-4.65,-8.005%,13995936000.00,United States,,25698965,Finance,Investment Bankers/Brokers/Service
COKE,Coca-Cola Consolidated Inc. Common Stock,$523.62,-8.10,-1.523%,4908251034.00,United States,1972,39190,Consumer Staples,Beverages (Production/Distribution)
COLD,Americold Realty Trust Inc. Common Stock,$28.66,-0.48,-1.647%,7732896639.00,United States,2018,1066507,Real Estate,Real Estate Investment Trusts
COLM,Columbia Sportswear Company Common Stock,$86.33,-1.24,-1.416%,5362269333.00,United States,1998,247444,Consumer Discretionary,Apparel
COO,The Cooper Companies Inc. Common Stock,$324.78,-10.06,-3.004%,16052361925.00,United States,,300006,Health Care,Ophthalmic Goods
COOP,Mr. Cooper Group Inc. Common Stock,$41.80,-1.79,-4.106%,2895337443.00,United States,,1126632,Finance,Finance: Consumer Services
COP,ConocoPhillips Common Stock,$104.22,-1.59,-1.503%,127020886205.00,United States,,5305289,Energy,Integrated oil Companies
CORT,Corcept Therapeutics Incorporated Common Stock,$20.70,-0.44,-2.081%,2228351978.00,United States,2004,1029272,Health Care,Biotechnology: Pharmaceutical Preparations
COST,Costco Wholesale Corporation Common Stock,$471.14,-8.38,-1.748%,209058498021.00,United States,,2122191,Consumer Discretionary,Department/Specialty Retail Stores
COTY,Coty Inc. Class A Common Stock,$10.72,-0.30,-2.722%,9139827201.00,United States,2013,7340879,Consumer Discretionary,Package Goods/Cosmetics
CP,Canadian Pacific Railway Limited Common Stock,$73.13,-0.85,-1.149%,68047465000.00,Canada,,1903249,,
CPA,Copa Holdings S.A. Copa Holdings S.A. Class A Common Stock,$93.28,-0.86,-0.914%,3676708529.00,Panama,2005,463603,Consumer Discretionary,Air Freight/Delivery Services
CPB,Campbell Soup Company Common Stock,$52.51,0.18,0.344%,15725041786.00,United States,,2612872,Consumer Staples,Packaged Foods
CPE,Callon Petroleum Company Common Stock,$36.46,-0.76,-2.042%,2246246676.00,United States,,1564303,Energy,Oil & Gas Production
CPG,Crescent Point Energy Corporation Ordinary Shares (Canada),$6.75,-0.15,-2.174%,3733580534.00,Canada,,8516327,,
CPK,Chesapeake Utilities Corporation Common Stock,$123.81,-0.92,-0.738%,2196517420.00,United States,,93358,Utilities,Oil & Gas Production
CPNG,Coupang Inc. Class A Common Stock,$13.29,-0.35,-2.566%,23527263450.00,,2021,5421810,Consumer Discretionary,Durable Goods
CPRI,Capri Holdings Limited Ordinary Shares,$42.88,-1.35,-3.052%,5390425504.00,Hong Kong,2011,4995446,Consumer Discretionary,Apparel
CPRT,Copart Inc. (DE) Common Stock,$68.40,-1.24,-1.781%,32578920752.00,United States,1994,2049718,Consumer Discretionary,Other Specialty Stores
CPT,Camden Property Trust Common Stock,$106.91,-3.88,-3.502%,11603583760.00,United States,1993,815642,Real Estate,Real Estate Investment Trusts
CQP,Cheniere Energy Partners LP Cheniere Energy Partners LP Common Units,$48.13,-0.88,-1.796%,23296442015.00,United States,2007,301423,Utilities,Oil/Gas Transmission
CR,Crane Holdings Co. Common Stock,$110.64,-6.86,-5.838%,6211819403.00,United States,,568382,Industrials,Office Equipment/Supplies/Services
CRBG,Corebridge Financial Inc. Common Stock,$17.87,-0.73,-3.925%,11526150000.00,,2022,2714579,Finance,Finance Companies
CRC,California Resources Corporation Common Stock,$40.37,-1.25,-3.003%,2966021525.00,,2020,557421,Energy,Oil & Gas Production
CRH,CRH PLC American Depositary Shares,$50.17,-0.69,-1.357%,37322084205.00,Ireland,,478293,Industrials,Building Materials
CRI,Carter's Inc. Common Stock,$70.02,-1.78,-2.479%,2672074532.00,United States,2003,665248,Consumer Discretionary,Department/Specialty Retail Stores
CRK,Comstock Resources Inc. Common Stock,$10.80,-0.76,-6.574%,2997109782.00,United States,,6131503,Energy,Oil & Gas Production
CRL,Charles River Laboratories International Inc. Common Stock,$202.54,-12.38,-5.76%,10304962986.00,United States,2000,1307310,Consumer Discretionary,EDP Services
CRM,Salesforce Inc. Common Stock,$173.18,-5.54,-3.10%,173180000000.00,United States,2004,14107317,Technology,Computer Software: Prepackaged Software
CROX,Crocs Inc. Common Stock,$115.32,-4.31,-3.603%,7121209734.00,United States,2006,1791800,Consumer Discretionary,Shoe Manufacturing
CRS,Carpenter Technology Corporation Common Stock,$45.11,-2.17,-4.59%,2188250418.00,United States,,366498,Industrials,Steel/Iron Ore
CRSP,CRISPR Therapeutics AG Common Shares,$43.22,-2.57,-5.613%,3383872688.00,Switzerland,2016,1761739,Health Care,Biotechnology: Biological Products (No Diagnostic Substances)
CRUS,Cirrus Logic Inc. Common Stock,$100.79,-1.07,-1.05%,5569369660.00,United States,1989,416577,Technology,Semiconductors
CRVL,CorVel Corp. Common Stock,$175.72,-1.71,-0.964%,3015176844.00,United States,,84355,Finance,Specialty Insurers
CRWD,CrowdStrike Holdings Inc. Class A Common Stock,$119.72,-1.96,-1.611%,28061625736.00,United States,2019,8040138,Technology,EDP Services
CS,Credit Suisse Group American Depositary Shares,$2.66,-0.11,-3.971%,10483858000.00,Switzerland,,37558797,Finance,Investment Bankers/Brokers/Service
CSAN,Cosan S.A. ADS,$11.47,-0.47,-3.936%,5352584752.00,,2021,335781,Consumer Discretionary,Retail-Auto Dealers and Gas Stations
CSCO,Cisco Systems Inc. Common Stock (DE),$48.56,-0.25,-0.512%,199489484739.00,United States,1990,16337520,Telecommunications,Computer Communications Equipment
CSGP,CoStar Group Inc. Common Stock,$67.08,-1.79,-2.599%,27280769225.00,United States,1998,2120316,Finance,Real Estate
CSIQ,Canadian Solar Inc. Common Shares (ON),$39.25,-2.16,-5.216%,2522551224.00,Canada,2006,1464984,,
CSL,Carlisle Companies Incorporated Common Stock,$243.10,-12.52,-4.898%,12434186493.00,United States,,556036,,
CSQ,Calamos Strategic Total Return Common Stock,$13.47,-0.25,-1.822%,2140216268.00,United States,2004,142523,Finance,Finance Companies
CSTM,Constellium SE Ordinary Shares (France),$14.91,-0.52,-3.37%,2151536737.00,Netherlands,2013,794529,Industrials,Aluminum
CSWI,CSW Industrials Inc. Common Stock,$136.67,-4.14,-2.94%,2114958000.00,United States,,80531,Industrials,Home Furnishings
CSX,CSX Corporation Common Stock,$29.49,-0.27,-0.907%,60826234249.00,United States,,18598769,Industrials,Railroads
CTAS,Cintas Corporation Common Stock,$428.30,-5.97,-1.375%,43524051156.00,United States,1983,310595,Consumer Discretionary,Business Services
CTLT,Catalent Inc. Common Stock,$67.92,-2.02,-2.888%,12231745605.00,United States,2014,2002227,Health Care,Biotechnology: Pharmaceutical Preparations
CTRA,Coterra Energy Inc. Common Stock,$24.59,-0.52,-2.071%,19388412161.00,United States,,11115505,Energy,Oil & Gas Production
CTSH,Cognizant Technology Solutions Corporation Class A Common Stock,$60.38,-0.53,-0.87%,30751209035.00,United States,1998,10746991,Technology,EDP Services
CTVA,Corteva Inc. Common Stock ,$58.89,-1.03,-1.719%,41978146470.00,,2019,2632510,Industrials,Major Chemicals
CUBE,CubeSmart Common Shares,$45.62,-1.10,-2.354%,10245097175.00,United States,,4075971,Real Estate,Real Estate Investment Trusts
CUK,Carnival Plc ADS ADS,$8.81,-0.25,-2.759%,11448823857.00,United States,,2059566,,
CUZ,Cousins Properties Incorporated Common Stock,$21.96,-1.86,-7.809%,3327629500.00,United States,,6458319,Real Estate,Real Estate Investment Trusts
CVBF,CVB Financial Corporation Common Stock,$21.61,0.16,0.746%,3021482172.00,United States,,1749011,Finance,Major Banks
CVCO,Cavco Industries Inc. Common Stock When Issued,$284.53,-5.04,-1.741%,2473618176.00,United States,,67328,Consumer Discretionary,Homebuilding
CVE,Cenovus Energy Inc Common Stock,$18.35,-0.23,-1.238%,35033643088.00,Canada,,5894038,,
CVI,CVR Energy Inc. Common Stock,$30.65,-0.48,-1.542%,3081262859.00,United States,2007,596817,Energy,Integrated oil Companies
CVLT,Commvault Systems Inc. Common Stock,$55.48,-1.32,-2.324%,2471817361.00,United States,2006,302796,Technology,Computer Software: Prepackaged Software
CVS,CVS Health Corporation Common Stock,$77.10,0.10,0.13%,99005009526.00,United States,,7848617,Health Care,Managed Health Care
CVT,Cvent Holding Corp. Common Stock,$7.19,0.00,0.00%,3508154147.00,United States,1987,498405,Technology,Computer Software: Prepackaged Software
CVX,Chevron Corporation Common Stock,$159.67,-0.84,-0.523%,308744066640.00,United States,,7378860,Energy,Integrated oil Companies
CW,Curtiss-Wright Corporation Common Stock,$170.43,-2.22,-1.286%,6528776880.00,United States,,144104,,
CWAN,Clearwater Analytics Holdings Inc. Class A Common Stock,$13.66,-1.22,-8.199%,2585974764.00,,2021,2248774,Technology,Computer Software: Prepackaged Software
CWEN,Clearway Energy Inc. Class C Common Stock,$29.73,-0.80,-2.62%,3472594753.00,United States,2015,621671,Utilities,Electric Utilities: Central
CWK,Cushman & Wakefield plc Ordinary Shares,$11.58,-0.51,-4.218%,2614262076.00,,2018,1713086,Finance,Real Estate
CWST,Casella Waste Systems Inc. Class A Common Stock,$75.41,-2.50,-3.209%,3898992155.00,United States,1997,248359,Utilities,Environmental Services
CWT,California Water Service Group Common Stock,$54.67,-0.95,-1.708%,2997228080.00,United States,,167963,Utilities,Water Supply
CX,Cemex S.A.B. de C.V. Sponsored ADR,$5.02,-0.21,-4.015%,7272869059.00,Mexico,,11219461,Industrials,Building Materials
CXM,Sprinklr Inc. Class A Common Stock,$10.17,-0.57,-5.307%,2654706810.00,,2021,944427,Technology,Computer Software: Prepackaged Software
CYBR,CyberArk Software Ltd. Ordinary Shares,$139.76,-3.99,-2.776%,5690514141.00,Israel,2014,420542,Technology,Computer Software: Prepackaged Software
CYTK,Cytokinetics Incorporated Common Stock,$35.60,-1.26,-3.418%,3368863636.00,United States,2004,1812035,Health Care,Biotechnology: Pharmaceutical Preparations
CZR,Caesars Entertainment Inc. Common Stock,$47.31,-2.00,-4.056%,10151122428.00,United States,,4107096,Consumer Discretionary,Hotels/Resorts
D,Dominion Energy Inc. Common Stock,$53.21,-1.06,-1.953%,44440652361.00,United States,,4088803,Utilities,Electric Utilities: Central
DADA,Dada Nexus Limited American Depositary Shares,$8.62,-0.33,-3.687%,2203178085.00,China,2020,3274765,Consumer Discretionary,Department/Specialty Retail Stores
DAL,Delta Air Lines Inc. Common Stock,$37.25,-1.24,-3.222%,23886139899.00,United States,,12925199,Consumer Discretionary,Air Freight/Delivery Services
DAN,Dana Incorporated Common Stock ,$14.50,-0.61,-4.037%,2078625243.00,United States,,1353407,Consumer Discretionary,Auto Parts:O.E.M.
DAR,Darling Ingredients Inc. Common Stock,$60.02,-1.23,-2.008%,9619490508.00,United States,1997,1348279,Consumer Staples,Farming/Seeds/Milling
DASH,DoorDash Inc. Class A Common Stock,$53.23,-2.05,-3.708%,20664809807.00,,2020,5145512,Industrials,Industrial Machinery/Components
DAVA,Endava plc American Depositary Shares (each representing one Class A Ordinary Share),$71.94,-4.81,-6.267%,4094139572.00,United Kingdom,2018,428238,Technology,EDP Services
DB,Deutsche Bank AG Common Stock,$11.12,-0.79,-6.633%,22662560000.00,Germany,,13492169,Finance,Commercial Banks
DBX,Dropbox Inc. Class A Common Stock,$19.12,-0.49,-2.499%,6935519547.00,United States,2018,3365913,Technology,Computer Software: Prepackaged Software
DCI,Donaldson Company Inc. Common Stock,$64.10,-1.32,-2.018%,7800131572.00,United States,,323711,Industrials,Pollution Control Equipment
DCP,DCP Midstream  LP Common Units ,$41.74,0.02,0.048%,8704903380.00,United States,,1105308,Utilities,Natural Gas Distribution
DCT,Duck Creek Technologies Inc. Common Stock,$18.90,-0.02,-0.106%,2511587150.00,United States,2020,5671071,Technology,Retail: Computer Software & Peripheral Equipment
DD,DuPont de Nemours Inc. Common Stock,$70.34,-0.48,-0.678%,32239498578.00,,2017,3515208,Consumer Discretionary,Wholesale Distributors
DDOG,Datadog Inc. Class A Common Stock,$65.14,-4.77,-6.823%,20685847847.00,United States,2019,12580630,Technology,EDP Services
DDS,Dillard's Inc. Common Stock,$335.82,-4.31,-1.267%,5750888619.00,United States,,110312,Consumer Discretionary,Department/Specialty Retail Stores
DE,Deere & Company Common Stock,$395.93,-25.49,-6.049%,117653392390.00,United States,,2353733,Industrials,Industrial Machinery/Components
DECK,Deckers Outdoor Corporation Common Stock,$412.32,-11.29,-2.665%,10868449259.00,United States,1993,398001,Consumer Discretionary,Shoe Manufacturing
DEI,Douglas Emmett Inc. Common Stock,$12.61,-0.73,-5.472%,2216960090.00,United States,2006,3908567,Real Estate,Real Estate Investment Trusts
DELL,Dell Technologies Inc. Class C Common Stock ,$36.72,-1.08,-2.857%,26296231029.00,,2018,3661074,Technology,Computer Manufacturing
DEN,Denbury Inc. Common Stock,$81.33,-1.80,-2.165%,4050243190.00,,2020,638952,Energy,Oil & Gas Production
DEO,Diageo plc Common Stock,$169.46,-0.39,-0.23%,95849793368.00,United Kingdom,,495302,Consumer Staples,Beverages (Production/Distribution)
DFS,Discover Financial Services Common Stock,$102.14,-3.50,-3.313%,27271380000.00,United States,,3118040,Finance,Finance: Consumer Services
DG,Dollar General Corporation Common Stock,$216.09,-1.37,-0.63%,48312278316.00,United States,2009,1436421,Consumer Discretionary,Department/Specialty Retail Stores
DGX,Quest Diagnostics Incorporated Common Stock,$134.31,-0.58,-0.43%,14908410000.00,United States,,1173933,Health Care,Medical Specialities
DHI,D.R. Horton Inc. Common Stock,$94.10,-0.84,-0.885%,32313314141.00,United States,,4655887,,
DHR,Danaher Corporation Common Stock,$239.75,-3.88,-1.593%,174609925000.00,United States,,3013468,Health Care,Medical Specialities
DINO,HF Sinclair Corporation Common Stock,$49.27,-0.57,-1.144%,9889993509.00,United States,1960,2410997,Energy,Integrated oil Companies
DIOD,Diodes Incorporated Common Stock,$88.24,-2.36,-2.605%,4013750202.00,United States,,150635,Technology,Semiconductors
DIS,Walt Disney Company (The) Common Stock,$93.57,-2.57,-2.673%,170934352230.00,United States,,13964030,Consumer Discretionary,Movies/Entertainment
DISH,DISH Network Corporation Class A Common Stock,$10.53,-0.76,-6.732%,5588339140.00,United States,1995,9481431,Consumer Discretionary,Telecommunications Equipment
DKL,Delek Logistics Partners L.P. Common Units representing Limited Partner Interests,$51.79,0.69,1.35%,2252459950.00,United States,2012,53425,Energy,Oil & Gas Production
DKNG,DraftKings Inc. Class A Common Stock,$18.55,-0.19,-1.014%,8377741471.00,United States,2019,14635538,Consumer Discretionary,Services-Misc. Amusement & Recreation
DKS,Dick's Sporting Goods Inc Common Stock,$146.27,-3.06,-2.049%,12200599520.00,United States,2002,1983667,Consumer Discretionary,Other Specialty Stores
DLB,Dolby Laboratories Common Stock,$80.25,-1.39,-1.703%,7689705549.00,United States,2005,364727,Technology,EDP Services
DLO,DLocal Limited Class A Common Shares,$14.05,-0.97,-6.458%,4158590529.00,Uruguay,2021,1755006,Consumer Discretionary,Business Services
DLR,Digital Realty Trust Inc. Common Stock,$102.54,-1.84,-1.763%,29854338684.00,United States,2004,2405010,Real Estate,Real Estate Investment Trusts
DLTR,Dollar Tree Inc. Common Stock,$140.29,0.65,0.465%,31029970559.00,United States,1995,1879957,Consumer Discretionary,Department/Specialty Retail Stores
DNA,Ginkgo Bioworks Holdings Inc. Class A Common Stock,$1.24,-0.01,-0.80%,2546265136.00,United States,2021,23021604,Health Care,Biotechnology: Biological Products (No Diagnostic Substances)
DNB,Dun & Bradstreet Holdings Inc. Common Stock,$11.31,-0.35,-3.002%,4927965230.00,United States,2020,2994056,Technology,Internet and Information Services
DNLI,Denali Therapeutics Inc. Common Stock,$23.22,-0.92,-3.811%,3153593371.00,United States,2017,1317812,Health Care,Biotechnology: Biological Products (No Diagnostic Substances)
DNP,DNP Select Income Fund Inc. Common Stock,$11.06,-0.21,-1.863%,3924694829.00,United States,1987,1081823,Finance,Investment Managers
DNUT,Krispy Kreme Inc. Common Stock,$13.30,-0.15,-1.115%,2236222100.00,United States,2021,762656,Consumer Discretionary,Specialty Foods
DOC,Physicians Realty Trust Common Shares of Beneficial Interest,$14.39,-0.35,-2.374%,3284673775.00,United States,2013,2830375,Real Estate,Real Estate Investment Trusts
DOCN,DigitalOcean Holdings Inc. Common Stock,$33.00,-1.55,-4.486%,3192172731.00,United States,2021,2517881,Technology,Retail: Computer Software & Peripheral Equipment
DOCS,Doximity Inc. Class A Common Stock,$29.08,-1.86,-6.012%,5629610141.00,,2021,2604565,Technology,Retail: Computer Software & Peripheral Equipment
DOCU,DocuSign Inc. Common Stock,$49.69,-14.72,-22.854%,9991374414.00,United States,2018,29021930,Technology,EDP Services
DOOO,BRP Inc. (Recreational Products) Common Subordinate Voting Shares,$79.06,-2.44,-2.994%,6225616621.00,Canada,,86768,,
DORM,Dorman Products Inc. Common Stock,$83.45,-1.38,-1.627%,2621880084.00,United States,,172349,Consumer Discretionary,Auto Parts:O.E.M.
DOV,Dover Corporation Common Stock,$145.80,-4.36,-2.904%,20370184560.00,United States,,1048758,Industrials,Industrial Machinery/Components
DOW,Dow Inc. Common Stock ,$53.88,-1.22,-2.214%,37978930090.00,,2019,5398695,Industrials,Industrial Specialties
DOX,Amdocs Limited Ordinary Shares,$90.73,-0.39,-0.428%,10940949240.00,Guernsey,,866088,Technology,EDP Services
DPZ,Domino's Pizza Inc Common Stock,$300.16,-8.96,-2.899%,10625477601.00,United States,2004,966614,Consumer Discretionary,Food Distributors
DQ,DAQO New Energy Corp. American Depositary Shares each representing five ordinary shares,$49.90,-0.85,-1.675%,3741489226.00,China,2010,1121750,Technology,Semiconductors
DRI,Darden Restaurants Inc. Common Stock,$143.97,-0.69,-0.477%,17521911465.00,United States,,1073910,Consumer Discretionary,Restaurants
DRS,Leonardo DRS Inc. Common Stock,$12.54,-0.33,-2.564%,3262748240.00,Israel,,609771,Industrials,Military/Government/Technical
DRVN,Driven Brands Holdings Inc. Common Stock,$27.30,-0.86,-3.054%,4570130483.00,United States,2021,352768,,
DSEY,Diversey Holdings Ltd. Ordinary Shares,$8.11,-0.03,-0.369%,2630202460.00,United States,2021,7643604,Consumer Discretionary,Specialty Chemicals
DSGX,Descartes Systems Group Inc. (The) Common Stock,$74.63,-0.65,-0.863%,6329966892.00,Canada,,125782,,
DT,Dynatrace Inc. Common Stock,$38.33,-2.17,-5.358%,11079357870.00,United States,2019,4429760,Technology,EDP Services
DTE,DTE Energy Company Common Stock,$104.48,-2.25,-2.108%,20242163220.00,United States,,1153040,Utilities,Electric Utilities: Central
DTM,DT Midstream Inc. Common Stock ,$49.42,-1.29,-2.544%,4788222603.00,,2021,463556,Utilities,Oil & Gas Production
DUK,Duke Energy Corporation (Holding Company) Common Stock,$92.83,-1.39,-1.475%,71484927125.00,United States,,2629116,Utilities,Power Generation
DUOL,Duolingo Inc. Class A Common Stock,$117.78,-3.63,-2.99%,4731191624.00,United States,2021,527421,Technology,Computer Software: Prepackaged Software
DV,DoubleVerify Holdings Inc. Common Stock,$24.66,-0.86,-3.37%,4065819645.00,,2021,1979377,Technology,Computer Software: Prepackaged Software
DVA,DaVita Inc. Common Stock,$74.68,-0.19,-0.254%,6728668000.00,United States,,918720,Health Care,Medical/Nursing Services
DVN,Devon Energy Corporation Common Stock,$51.76,-1.22,-2.303%,33851040000.00,United States,1985,12342896,Energy,Oil & Gas Production
DXC,DXC Technology Company Common Stock ,$25.51,-0.88,-3.335%,5808180116.00,,,1838930,Technology,EDP Services
DXCM,DexCom Inc. Common Stock,$107.77,-4.31,-3.845%,41643803371.00,United States,2005,3014348,Health Care,Medical Specialities
DY,Dycom Industries Inc. Common Stock,$99.24,-3.13,-3.058%,2933202839.00,United States,,714017,Industrials,Water Sewer Pipeline Comm & Power Line Construction
E,ENI S.p.A. Common Stock,$28.16,0.22,0.787%,47103093199.00,Italy,,561492,Energy,Oil & Gas Production
EA,Electronic Arts Inc. Common Stock,$109.19,-1.27,-1.15%,29942911207.00,United States,,2898243,Consumer Discretionary,Recreational Games/Products/Toys
EBAY,eBay Inc. Common Stock,$42.04,-0.91,-2.119%,22813388017.00,United States,1998,4526740,Consumer Discretionary,Catalog/Specialty Distribution
EBC,Eastern Bankshares Inc. Common Stock,$13.81,-0.45,-3.156%,2432936328.00,United States,2020,2811760,Finance,Major Banks
EBR,Centrais Electricas Brasileiras S A American Depositary Shares (Each representing one Common Share),$6.12,-0.14,-2.236%,14056374366.00,,2016,1368482,Utilities,Electric Utilities: Central
EC,Ecopetrol S.A. American Depositary Shares,$10.87,-0.14,-1.272%,22346923559.00,Colombia,,2845741,Energy,Oil & Gas Production
ECL,Ecolab Inc. Common Stock,$158.07,0.42,0.266%,45022771444.00,United States,,1467623,Consumer Discretionary,Package Goods/Cosmetics
ED,Consolidated Edison Inc. Common Stock,$90.62,-0.67,-0.734%,32174179803.00,United States,,1969109,Utilities,Power Generation
EDR,Endeavor Group Holdings Inc. Class A Common Stock,$23.06,-0.38,-1.621%,6674114327.00,,2021,1278010,Consumer Discretionary,Movies/Entertainment
EDU,New Oriental Education & Technology Group Inc. Sponsored ADR representing 10 Ordinary Share (Cayman Islands),$40.41,1.08,2.746%,6867177567.00,China,2006,1200637,Consumer Discretionary,Other Consumer Services
EEFT,Euronet Worldwide Inc. Common Stock,$101.17,-4.13,-3.922%,5017412536.00,United States,1997,476224,Technology,EDP Services
EFX,Equifax Inc. Common Stock,$193.14,-4.05,-2.054%,23659650000.00,United States,,894455,Finance,Advertising
EGP,EastGroup Properties Inc. Common Stock,$156.14,-6.03,-3.718%,6800576209.00,United States,,259697,Real Estate,Real Estate Investment Trusts
EHC,Encompass Health Corporation Common Stock,$53.38,-0.67,-1.24%,5326708262.00,United States,,972226,Health Care,Medical Specialities
EIX,Edison International Common Stock,$66.23,-0.77,-1.149%,25291559659.00,United States,,1856666,Utilities,Electric Utilities: Central
EL,Estee Lauder Companies Inc. (The) Common Stock,$236.20,-7.28,-2.99%,84375410768.00,United States,1995,1260274,Consumer Discretionary,Package Goods/Cosmetics
ELAN,Elanco Animal Health Incorporated Common Stock,$9.57,-0.54,-5.341%,4538145965.00,United States,2018,12196037,Health Care,Biotechnology: Pharmaceutical Preparations
ELF,e.l.f. Beauty Inc. Common Stock,$69.57,-1.56,-2.193%,3707712418.00,United States,2016,1143513,Consumer Discretionary,Package Goods/Cosmetics
ELP,Companhia Paranaense de Energia (COPEL) American Depositary Shares (each representing one Unit consisting one Common Share and four non-voting Class B Preferred Shares),$6.32,-0.11,-1.711%,17295019700.00,Brazil,2021,282656,Utilities,Electric Utilities: Central
ELS,Equity Lifestyle Properties Inc. Common Stock,$63.52,-1.65,-2.532%,11822361329.00,United States,,946849,Real Estate,Real Estate Investment Trusts
ELV,Elevance Health Inc. Common Stock,$454.56,-5.40,-1.174%,107938806659.00,United States,,1282917,Health Care,Medical Specialities
EME,EMCOR Group Inc. Common Stock,$158.49,-6.40,-3.881%,7552880731.00,United States,,417210,Industrials,Engineering & Construction
EMN,Eastman Chemical Company Common Stock,$80.75,-1.85,-2.24%,9592847010.00,United States,,883269,Industrials,Major Chemicals
EMR,Emerson Electric Company Common Stock,$82.17,-1.27,-1.522%,46951938000.00,United States,,3784535,Industrials,Industrial Machinery/Components
ENB,Enbridge Inc Common Stock,$37.84,-0.15,-0.395%,76622517396.00,Canada,,3853737,Energy,Oil & Gas Production
ENIC,Enel Chile S.A. American Depositary Shares (Each representing 50 shares of Common Stock),$2.37,-0.09,-3.659%,3278494811.00,,2016,284286,Utilities,Electric Utilities: Central
ENLC,EnLink Midstream LLC Common Units representing Limited Partner Interests,$11.18,-0.12,-1.062%,5261715433.00,,,3241600,Utilities,Natural Gas Distribution
